company_id,Company name,Company address,company_name_slug,company_no,reviews_count,average_company_rating,company_review_summary_url,company_review_url,foreign_company_id,map_address,map_latitude,map_longitude,industry,website_url,Secondary Address,Company Tel,Company Email,Contact Person,Position,FET,FCA,FOB,FCM,FOE,FOM,FIST,FCI,tertiary address
440053,Kollect Systems Sdn Bhd,"38-2 Jalan Teknologi 3/6C, Kota Damansara, 47810 Petaling Jaya, Selangor, Malaysia",kollect-systems-440053,483922-V,22,3.2727,/companies/440053/company-reviews/summary,/companies/440053/company-reviews,1894,"38-2 Jalan Teknologi 3/6C, Kota Damansara, 47810 Petaling Jaya, Selangor, Malaysia",,,Computer/Information Technology (Software),http://www.kollect.my,,,,,,0,0,0,0,0,0,0,1,
,Komuniti Filem Titiwangsa (KOMFIT),,,,,,,,,,,,,,,'019-3596769',jafreeyusop@gmail.com,Al-Jafree Md Yusop, Film Director and Founder of KOMFIT,0,1,0,0,0,0,0,0,
472638,Kong & Associates Electrical Services,"No 35, Jalan Masai Jaya 1 Masai Johor Malaysia",kong-n-associates-electrical-services-472638,JM-0716725-H,0,0,/companies/472638/company-reviews/summary,/companies/472638/company-reviews,94682,"No 35, Jalan Masai Jaya 1 Masai Johor Malaysia",1.522162,103.813409,Construction/Building/Engineering,,,,,,,0,0,0,0,1,0,0,0,
,Konta Biz Solutions sdn bhd,"Menara Uncang Emas UE3,
No.85, Jalan Loke Yew, Taman Miharja,
55200 Kuala Lumpur.",,,,,,,,,,,,,,,,,,0,0,0,0,0,0,0,1,
463385,KOO & CO.,77-01 Jalan Mutiara Emas 10/2  Taman Mount Austin 81100 Johor Bahru Johor,koo-n-co-463385,AF1136,3,4.3333,/companies/463385/company-reviews/summary,/companies/463385/company-reviews,82428,77-01 Jalan Mutiara Emas 10/2  Taman Mount Austin 81100 Johor Bahru Johor,1.548914,103.779193,Accounting/Audit/Tax Services,,,,,,,0,0,1,0,0,0,0,0,
997584,Koperasi Kakitangan PETRONAS Berhad (KOPETRO),"Jalan Yap Kwan Seng, 50450 Kuala Lumpur, Federal Territory of Kuala Lumpur, Malaysia",koperasi-kakitangan-petronas-berhad-kopetro-443520,KOOP.INST.NO.14,79,3.8101,/companies/443520/company-reviews/summary,/companies/443520/company-reviews,13224,"Jalan Yap Kwan Seng, 50450 Kuala Lumpur, Federal Territory of Kuala Lumpur, Malaysia",,,Banking/Financial Services,http://www.kopetro.com.my/,,,,,,0,0,0,1,0,0,0,0,
1010398,Kopitiam Asia Pacific Sdn Bhd,"Lot 896, Jalan Subang 10, Taman Perindustrian Subang, 47600 Subang Jaya, Selangor",kopitiam-asia-pacific-617529,196428-X,13,4.1538,/companies/617529/company-reviews/summary,/companies/617529/company-reviews,19369,"Lot 896, Jalan Subang 10, Taman Perindustrian Subang, 47600 Subang Jaya, Selangor",,,Food & Beverage/Catering/Restaurant,,,,,,,0,0,0,1,0,0,0,0,
655301,KPMG,163e Jalan Kelawei Georgetown George Town Penang Malaysia,kpmg-655301,LLP0010081-LCA,79,4.4051,/companies/655301/company-reviews/summary,/companies/655301/company-reviews,95875,163e Jalan Kelawei Georgetown George Town Penang Malaysia,5.439138,100.307887,Accounting/Audit/Tax Services,,"Level 10, KPMG Tower 8, First Avenue, Bandar Utama, 47800 Petaling Jaya",03-77213388,,,,0,0,1,0,0,1,1,1,"Level 10, KPMG Tower, 8, First Avenue, Bandar Utama, 47800 Petaling Jaya, Selangor"
443304,KPMG PLT,"Level 10, KPMG Tower, 8 First Avenue, Bandar Utama, 47800 Petaling Jaya, Selangor",kpmg-plt-443304,567386-P,309,4.165,/companies/443304/company-reviews/summary,/companies/443304/company-reviews,12626,"Level 10, KPMG Tower, 8 First Avenue, Bandar Utama, 47800 Petaling Jaya, Selangor",,,Consulting (Business & Management),http://www.kpmg.com/my,"Level 3, CIMB Leadership Academy,
No. 3, Jalan Medini Utara 1,
Medini Iskandar,
79200, Iskandar Puteri,
Johor Darul Takzim.",,,,,0,0,1,0,0,0,0,0,
447418,Kreateevee Sdn Bhd,Kreateevee Sdn Bhd Jalan Presiden U1/1 Shah Alam Selangor Malaysia,kreateevee-447418,626043-U,10,2.3,/companies/447418/company-reviews/summary,/companies/447418/company-reviews,26021,Kreateevee Sdn Bhd Jalan Presiden U1/1 Shah Alam Selangor Malaysia,3.094909,101.587123,Others,,,,,,,0,0,0,0,0,0,0,1,
,KRR FAMILY SDN BHD,,,,,,,,,,,,,,,,,,,0,0,0,1,0,0,0,0,
451046,KRU Malaysia Sdn Bhd,KRU Studios Sdn. Bhd. Cyberjaya Selangor Malaysia,kru-malaysia-451046,688248-K,8,4.125,/companies/451046/company-reviews/summary,/companies/451046/company-reviews,37493,KRU Studios Sdn. Bhd. Cyberjaya Selangor Malaysia,2.902239,101.652174,Entertainment/Media,,,'013-3976495',umihamira@gmail.com,Umi Hamira Abd Aziz, Line Producer / Head of Operation,0,1,0,0,0,0,0,0,
442577,KTP & COMPANY PLT,"Wisma KTP, 53 Jalan Molek 1/8 Taman Molek Johor Bahru Johor Malaysia",ktp-n-company-plt-442577,LLP0002159-LCA,14,3.4286,/companies/442577/company-reviews/summary,/companies/442577/company-reviews,10454,"Wisma KTP, 53 Jalan Molek 1/8 Taman Molek Johor Bahru Johor Malaysia",1.529734,103.789383,Accounting/Audit/Tax Services,,,,,,,0,0,1,0,0,0,0,0,
1.58E+14,KUDOS LING CHUO & LIM,"57A, Jalan Chengal, Taman Batu Pahat, 83000 Batu Pahat, Johor, Malaysia.",kudos-ling-chuo-n-lim-157501755921964,AF0881,0,0,/companies/157501755921964/company-reviews/summary,/companies/157501755921964/company-reviews,179736,,,,Accounting/Audit/Tax Services,http://www.kudoslcl.com.my,,,,,,0,0,1,0,0,0,0,0,
1272452,KUMPULAN NAGA,N0 122 JALAN THAMBY ABDULLAH OFF JALAN TUN SAMBANTHAN BRICKFIELDS,kumpulan-naga-1272452,AF0024,18,4.3333,/companies/1272452/company-reviews/summary,/companies/1272452/company-reviews,6592,N0 122 JALAN THAMBY ABDULLAH OFF JALAN TUN SAMBANTHAN BRICKFIELDS,,,Accounting/Audit/Tax Services,http://www.kumpulannaga.com/,,,,,,0,0,0,0,0,1,0,0,
443956,KUMPULAN VOIR SDN BHD,"Lot 1878, Jalan KBP 9, Kawasan Perindustrian Kg Baru Balakong, Off Jalan Balakong, 43300 Seri Kembangan, Selangor, Malaysia",kumpulan-voir-443956,169951-A,42,3.1951,/companies/443956/company-reviews/summary,/companies/443956/company-reviews,14552,"Lot 1878, Jalan KBP 9, Kawasan Perindustrian Kg Baru Balakong, Off Jalan Balakong, 43300 Seri Kembangan, Selangor, Malaysia",,,Retail/Merchandise,http://voir.com.my/V4/,,,,,,0,0,0,0,0,1,0,0,
,KX & PARTNERS SDN BHD,"B18-01 Zen Residence, Jalan Bunga Tanjung, Batu 14, 47100 Puchong, Selangor.",,,,,,,,,,,,,,,,,,0,0,0,0,0,0,1,0,
1.63E+14,KY SIOW & CO PLT,"123A, Jalan TMR 25, Taman Melaka Raya, 75000 Melaka.",ky-siow-n-co-plt-163306944057147,AF1359,0,0,/companies/163306944057147/company-reviews/summary,/companies/163306944057147/company-reviews,220180,"123A, Jalan TMR 25, Taman Melaka Raya, 75000 Melaka.",,,Accounting/Audit/Tax Services,,,,,,,0,0,1,0,0,0,0,0,
1.57E+14,KYROL Security Labs Sdn Bhd,"iTech Tower Level 9, 01, Cyberjaya",kyrol-security-labs-156621553293606,1087770-X,0,0,/companies/156621553293606/company-reviews/summary,/companies/156621553293606/company-reviews,173288,"iTech Tower Level 9, 01, Cyberjaya",,,Computer/Information Technology (Software),http://www.kyrolsecuritylabs.com,,,,,,0,0,0,0,0,0,0,1,
,LANTING ANIMATION,,,,,,,,,,,,,,,,,,,0,0,0,1,0,0,0,0,
1011099,LATITUDE MARKETING SDN. BHD.,8-1 Lorong Batu Nilam 3c Klang Selangor Malaysia,latitude-marketing-828873,1103257-K,2,4,/companies/828873/company-reviews/summary,/companies/828873/company-reviews,104628,8-1 Lorong Batu Nilam 3c Klang Selangor Malaysia,3.007962,101.43539,General & Wholesale Trading,,,,,,,0,0,0,1,0,0,0,0,
,LavaX Technologies Sdn Bhd,"2-3, Jalan Merbah 1, Bandar Puchong Jaya, 47170 Puchong, Selangor",,,,,,,,,,,,,,,,,,0,0,0,0,0,0,0,1,
,LCM & CO,"No. 29-1 Jalan PM14
Plaza Pandan Malim Business Park
Balai Panjang, 75250 Melaka.",,,,,,,,,,,,,,,,,,0,0,1,0,0,0,0,0,
1209746,Leave a Nest Malaysia,"L1-06, Block 3710, Persiaran Apec, Cyber 8, 63000 Cyberjaya, Selangor",leave-a-nest-malaysia-1209746,1066170-P,1,,/companies/1209746/company-reviews/summary,/companies/1209746/company-reviews,121197,,,,Consulting (Business & Management),,,,,,,0,0,0,0,0,0,1,0,
656726,LEE & LIM TAX CONSULTANTS SDN BHD,"2B-9, JALAN KESIDANG 3/6, OFF JALAN TUN PERAK , 75300 MELAKA.",lee-n-lim-tax-consultants-656726,784259-H,3,4.6667,/companies/656726/company-reviews/summary,/companies/656726/company-reviews,96838,"2B-9, JALAN KESIDANG 3/6, OFF JALAN TUN PERAK , 75300 MELAKA.",,,Accounting/Audit/Tax Services,,,,,,,0,0,1,0,0,0,0,0,
,Lee & Tan Associates PLT,"NO.18B, JALAN MAJU TIMUR, TAMAN MAJU, 83000 BATU PAHAT, JOHOR.",,,,,,,,,,,,,,,,,,0,0,1,0,0,0,0,0,
1012499,Leeden Hercules Sdn Bhd,,leeden-hercules-451517,595657-M,17,3.4118,/companies/451517/company-reviews/summary,/companies/451517/company-reviews,39106,,,,Heavy Industrial/Machinery/Equipment,http://www.leedenhercules.com/,,,,,,0,0,0,1,0,0,0,0,
1013231,Lemon Sky Animation Sdn Bhd,"Unit 3-13A-01, Tower 3, Level 13A. UOA Business Park, No. 1, Jalan Pengaturcara U1/51a, Section U1, 40150 Shah Alam, Selangor",lemon-sky-animation-459417,900350-M,13,4.0769,/companies/459417/company-reviews/summary,/companies/459417/company-reviews,65991,"Unit 3-13A-01, Tower 3, Level 13A. UOA Business Park, No. 1, Jalan Pengaturcara U1/51a, Section U1, 40150 Shah Alam, Selangor",3.111094,101.582304,Computer/Information Technology (Software),http://www.lemonsky.tv/about.php,,,,,,0,0,0,1,0,0,0,0,
867554,Leong Poh Seng,"No.90A, 1st Floor, Jalan Kenanga 29/7, Bandar Indahpura, 81000 Kulai, Johor.",leong-poh-seng-867554,002062724-H,0,0,/companies/867554/company-reviews/summary,/companies/867554/company-reviews,107711,,,,Insurance,,,,,,,0,0,1,0,0,0,0,0,
,LEPAKIES SDN BHD,,,,,,,,,,,,,,,,,,,0,0,0,1,0,0,0,0,
1002830,LEPRO MANAGEMENT SERVICES SDN. BHD.,"SS1-17 Skypod Square, Persiaran Puchong Jaya Selatan, Bandar Puchong Jaya, 47100 Puchong, Selangor, Malaysia.",lepro-management-services-1002830,1180417-X,1,1,/companies/1002830/company-reviews/summary,/companies/1002830/company-reviews,111851,"SS1-17 Skypod Square, Persiaran Puchong Jaya Selatan, Bandar Puchong Jaya, 47100 Puchong, Selangor, Malaysia.",,,Computer/Information Technology (Software),http://www.leprosystemberhad.com,,,,,,0,0,0,0,0,0,0,1,
1.61226E+14,LIFE WEALTH RESOURCES SDN. BHD.,Seremban,life-wealth-resources-161226476813360,001097177-A,0,0,/companies/161226476813360/company-reviews/summary,/companies/161226476813360/company-reviews,201271,Seremban,,,Banking/Financial Services,,"167, 1ST FLOOR, JALAN TOMAN 8, KEMAYAN SQUARE, 70200, SEREMBAN, NEGERI SEMBILAN.",,,,,0,0,0,0,0,1,0,0,
1016751,LIGHT UP 7 SDN. BHD.,3-2 Jalan SS15/7 47500 Subang Jaya Selangor,light-up-7-876694,1097019-X,16,3.875,/companies/876694/company-reviews/summary,/companies/876694/company-reviews,108237,3-2 Jalan SS15/7 47500 Subang Jaya Selangor,3.076191,101.590359,Advertising/Marketing/Promotion/PR,http://lightup7.com,,,,,,0,0,0,1,0,0,0,0,
615553,Lightflex Innovations Sdn Bhd,"No. 3332, 2nd Floor, Jalan Perniagaan, Pusat Perniagaan Alma, 14000 Bukit Mertajam, Pulau Pinang, Malaysia.",lightflex-innovations-615553,494218-X,3,5,/companies/615553/company-reviews/summary,/companies/615553/company-reviews,15218,"No. 3332, 2nd Floor, Jalan Perniagaan, Pusat Perniagaan Alma, 14000 Bukit Mertajam, Pulau Pinang, Malaysia.",5.333702,100.481206,Computer/Information Technology (Software),https://www.lightflex.com.my,,,,,,0,0,0,0,0,0,1,0,
609907,Likom Group,"19401-1, Jalan TTC 12, Taman Teknologi Cheng, 75260 Melaka, Malaysia.",likom-group-609907,1.99E+11,13,3.5385,/companies/609907/company-reviews/summary,/companies/609907/company-reviews,2012,"19401-1, Jalan TTC 12, Taman Teknologi Cheng, 75260 Melaka, Malaysia.",,,Manufacturing/Production,http://www.likom.com.my,,,,,,1,0,0,0,0,0,0,0,
,LIL CRITTER WORKSHOP SDN BHD,,,,,,,,,,,,,,,,,,,0,0,0,1,0,0,0,0,
,LILIN+CO,,,,,,,,,,,,,,,,,,,0,0,0,1,0,0,0,0,
,LIM & LIM COMMERCIAL SERVICES,"14A, JALAN PERDANA 23A, TAMAN BUKIT PERDANA, 83000 BATU PAHAT, JOHOR.",,,,,,,,,,,,,,,,,,0,0,1,0,0,0,0,0,
,LIM KAI SIANG & CO.,"7A, Jalan Permas 1/25, Bandar Baru Permas Jaya, 81750, Masai, Johor",,,,,,,,,,,,,,,,,,0,0,1,0,0,0,0,0,
440621,Li-Zainal Sdn Bhd,"Jalan SS 7/13b, Kelana Jaya, 47301 Petaling Jaya, Selangor, Malaysia",li-zainal-440621,163608-W,12,4.8333,/companies/440621/company-reviews/summary,/companies/440621/company-reviews,3916,"Jalan SS 7/13b, Kelana Jaya, 47301 Petaling Jaya, Selangor, Malaysia",3.097492,101.598266,"Consulting (IT, Science, Engineering & Technical)",http://www.li-zainal.com,,,,,,0,0,0,0,1,0,0,0,
1.62E+14,LK CHONG & CO.,"327-A, Jalan Melaka Raya 1,
Taman Melaka Raya, 75000, 
Melaka, Malaysia. ",lk-chong-n-co-162140541514534,,1,4,/companies/162140541514534/company-reviews/summary,/companies/162140541514534/company-reviews,209738,,,,Others,,,,,,,0,0,1,0,0,0,0,0,
,LLS Asia Consulting Sdn Bhd,"No. 6, Jalan Melaka Raya 11, Taman Melaka Raya, 75000 Melaka",,,,,,,,,,,,,,,,,,0,0,1,0,0,0,0,0,
642123,LLY & ASSOCIATES,"Jalan Kota Laksamana 2, Taman Kota Laksamana, 75200 Melaka, Malaysia",lly-n-associates-642123,NF 0608,13,2.4615,/companies/642123/company-reviews/summary,/companies/642123/company-reviews,65222,"Jalan Kota Laksamana 2, Taman Kota Laksamana, 75200 Melaka, Malaysia",2.192305,102.242952,Accounting/Audit/Tax Services,,,,,,,0,0,1,0,0,0,0,0,
447456,Logicalis Asia Pacific MSC Sdn Bhd,"CoPlace 3, Cyberjaya Selangor Malaysia",logicalis-asia-pacific-msc-447456,735447-M,37,3.9189,/companies/447456/company-reviews/summary,/companies/447456/company-reviews,26138,"CoPlace 3, Cyberjaya Selangor Malaysia",,,Computer/Information Technology (Software),https://www.au.logicalis.com,,,,,,0,0,0,0,0,0,1,1,
632437,LOI & CO.,"23B Jalan Kenari 3, Bandar Puchong Jaya, 47100 Puchong, Selangor, Malaysia",loi-n-co-632437,--,4,4.75,/companies/632437/company-reviews/summary,/companies/632437/company-reviews,48833,"23B Jalan Kenari 3, Bandar Puchong Jaya, 47100 Puchong, Selangor, Malaysia",3.044604,101.621427,Law/Legal,,"82-A-1 & 83-B-1, LORONG HARUAN 5/4
OAKLAND COMMERCE SQUARE
70300 SEREMBAN
NEGERI SEMBILAN DARUL KHUSUS",,,,,0,0,1,0,0,0,0,0,
445610,Longbow Technologies Sdn. Bhd.,"No. 2A, Jalan BP 4/6, Bandar Bukit Puchong Industrial Park, 47120 Puchong, Selangor",longbow-technologies-445610,639862V,6,4,/companies/445610/company-reviews/summary,/companies/445610/company-reviews,20009,"No. 2A, Jalan BP 4/6, Bandar Bukit Puchong Industrial Park, 47120 Puchong, Selangor",,,Computer/Information Technology (Software),,,,,,,0,0,0,0,0,0,0,1,
1.6692E+14,LUCRO INFINITY SDN. BHD.,,lucro-infinity-166920273943587,,0,0,/companies/166920273943587/company-reviews/summary,/companies/166920273943587/company-reviews,309733,"E2.05.08, TAMARIND SQUARE, PERSIARAN MULTIMEDIA, 63000, CYBERJAYA",,,Others,,,,,,,0,0,0,1,0,0,0,1,
439381,Lumileds Malaysia Sdn Bhd,"No. 3 Lintang Bayan Lepas 8, Kawasan Perindustrian Bayan Lepas Fasa 4, Mukim 12 11900 Penang",lumileds-malaysia-439381,1.99901E+11,91,3.978,/companies/439381/company-reviews/summary,/companies/439381/company-reviews,9,"No. 3 Lintang Bayan Lepas 8, Kawasan Perindustrian Bayan Lepas Fasa 4, Mukim 12 11900 Penang",,,Electrical & Electronics,http://www.lumileds.com/,,,,,,0,0,0,0,1,0,0,0,
459198,LUMINANCE SYSTEMS SDN.BHD,"42A, 2 floor, Jalan Meru Indah 19/KU 8, Taman Perindustrian Meru Indah, 42200 Kapar",luminance-systems-459198,944703-A,1,5,/companies/459198/company-reviews/summary,/companies/459198/company-reviews,65073,"42A, 2 floor, Jalan Meru Indah 19/KU 8, Taman Perindustrian Meru Indah, 42200 Kapar",3.130798,101.420155,Electrical & Electronics,http://www.luminancesys.com,,,,,,0,0,0,0,1,0,0,0,
,Luminari Sdn Bhd,,,,,,,,,,,,,,,'014-6308305',khri.suhaimi@gmail.com,Mohd Fakhri Bin Suhaimi, Creative Director,0,1,0,0,0,0,0,0,
,Luminus ShamalStart,,,,,,,,,,,,,,,,,,,1,0,0,0,0,0,0,0,"Irbid Development Area Luminus Technical University College (LTUC), Building #1"
,LUMOS LABS INTERNATIONAL PTE LTD,,,,,,,,,,,,,,,,,,,0,0,0,1,0,0,0,0,
620305,LY Furniture Sdn Bhd,15 Jalan Wawasan Utama Kawasan Perindustrian Sri Gading Batu Pahat Johor Malaysia,ly-furniture-620305,221900-K,5,3.8,/companies/620305/company-reviews/summary,/companies/620305/company-reviews,25146,15 Jalan Wawasan Utama Kawasan Perindustrian Sri Gading Batu Pahat Johor Malaysia,1.858466,102.995911,Manufacturing/Production,http://www.lyfurniture.com,,,,,,0,0,0,0,0,0,1,0,
,LY LAW & ASSOCIATES,"No.54A, Jalan Gunung Lambak 1, Taman Gunung Lambak, 86000 Kluang, Johor.",,,,,,,,,,,,,,,,,,0,0,1,0,0,0,0,0,
1211634,M&C Saatchi (M) Sdn Bhd,"Unit 10.2, 10th Floor, Bangunan Malaysian RE, 17 Lorong Dungun,  Damansara Heights,  50490 Kuala Lumpur",mnc-saatchi-m-449815,606166-D,8,4.25,/companies/449815/company-reviews/summary,/companies/449815/company-reviews,33563,"Unit 10.2, 10th Floor, Bangunan Malaysian RE, 17 Lorong Dungun,  Damansara Heights,  50490 Kuala Lumpur",,,Advertising/Marketing/Promotion/PR,,,,,,,0,0,0,1,0,0,0,0,
1211960,Machino,,machino-161582521941520,SA0134039-P,0,0,/companies/161582521941520/company-reviews/summary,/companies/161582521941520/company-reviews,204276,,,,Others,,,,,,,0,0,0,1,0,0,0,0,
1215145,MADEX GROUP SDN. BHD.,,madex-group-167153531950985,1457963-D,0,0,/companies/167153531950985/company-reviews/summary,/companies/167153531950985/company-reviews,312544,,,,Advertising/Marketing/Promotion/PR,,,,,,,0,0,0,1,0,0,0,0,
,MAJLIS AGAMA ISLAM NEGERI SEMBILAN,"Aras 13, Menara MAINS, Jalan Taman Bunga, Taman Tasek Seremban, 70000 Seremban, Negeri Sembilan",,,,,,,,,,,,,,,,,,0,0,0,0,0,0,1,0,
,MAJLIS BANDARAYA IPOH,"Greentown, Ipoh",,,,,,,,,,,,,,,,,,0,0,0,0,0,0,1,0,
,MAJLIS PERBANDARAN HANG TUAH JAYA MELAKA,"MAJLIS PERBANDARAN HANG TUAH JAYA
SF-01,Aras 2, Kompleks Melaka Mall, 
Jalan Tun Abdul Razak - Ayer Keroh 
Hang Tuah Jaya, 75450 Ayer Keroh, Melaka.",,,,,,,,,,,,,,,,,,0,0,0,0,0,1,0,0,
610110,Malayan Banking Berhad (Maybank),Menara Maybank Jalan Tun Perak Kuala Lumpur Wilayah Persekutuan Kuala Lumpur Malaysia,malayan-banking-berhad-maybank-610110,3813-K,810,4.279,/companies/610110/company-reviews/summary,/companies/610110/company-reviews,3220,Menara Maybank Jalan Tun Perak Kuala Lumpur Wilayah Persekutuan Kuala Lumpur Malaysia,,,Banking/Financial Services,http://www.maybank.com/,,,,,,0,0,0,0,0,0,0,1,
440121,Malaysia Airlines Berhad,"Level 1, Administration Building, Southern Support Building, KLIA, 64000 Sepang, Selangor, Malaysia",malaysia-airlines-berhad-440121,1116944-X,272,4.1838,/companies/440121/company-reviews/summary,/companies/440121/company-reviews,2329,"Level 1, Administration Building, Southern Support Building, KLIA, 64000 Sepang, Selangor, Malaysia",,,Aerospace/Aviation/Airline,http://www.malaysiaairlines.com,,,norwahidi.kamit@malaysiaairlines.com,Mr. Norwahidi Kamit," Foreman, In-house Development E&m Maintenance",1,0,0,0,0,0,0,0,
610539,Malaysia Airports Holdings Berhad,Malaysia Airports Holdings Berhad Sepang Selangor Malaysia,malaysia-airports-holdings-berhad-610539,487092-W,431,4.5186,/companies/610539/company-reviews/summary,/companies/610539/company-reviews,5505,Malaysia Airports Holdings Berhad Sepang Selangor Malaysia,2.786767,101.67469,Aerospace/Aviation/Airline,,"IT Delivery (Digital and Big Data) Malaysia Airports Holdings Berhad 3rd Floor, Airport Management Centre KL International Airport 64000 KLIA, Sepang, Selangor",,,,,0,0,0,0,0,0,1,0,
458336,MALAYSIA AUTOMOTIVE ROBOTICS AND IOT INSTITUTE,"Block 2280, Jalan Usahawan 2, Cyber 6, 63000 Cyberjaya Selangor",malaysia-automotive-robotics-and-iot-institute-458336,898618-T,10,4.2,/companies/458336/company-reviews/summary,/companies/458336/company-reviews,61502,"Block 2280, Jalan Usahawan 2, Cyber 6, 63000 Cyberjaya Selangor",,,"Consulting (IT, Science, Engineering & Technical)",,,,,,,0,0,0,0,1,0,0,0,
,MALAYSIA PRODUCTIVITY CORPORATION(MPC) PETALING JAYA SELANGOR,,,,,,,,,,,,,,,,,,,0,0,0,1,0,0,0,0,
629109,MALAYSIA TRANSFORMER MANUFACTURING SDN. BHD,Lot 22 Jalan AU 3/1 Taman Keramat Kuala Lumpur Selangor Malaysia,malaysia-transformer-manufacturing-629109,31108-W,8,4.5,/companies/629109/company-reviews/summary,/companies/629109/company-reviews,42315,Lot 22 Jalan AU 3/1 Taman Keramat Kuala Lumpur Selangor Malaysia,3.186751,101.759741,Manufacturing/Production,,,,,,,0,0,0,0,1,0,0,0,
1216784,MALAYSIAN GREEN TECHNOLOGY AND CLIMATE CHANGE CORPORATION,"No. 2 Jalan 9/10, Persiaran Usahawan, Seksyen 9, 43650 Bandar Baru Bangi, Selangor, Malaysia",malaysian-green-technology-and-climate-change-corporation-443044,462237-T,11,2.8182,/companies/443044/company-reviews/summary,/companies/443044/company-reviews,11886,"No. 2 Jalan 9/10, Persiaran Usahawan, Seksyen 9, 43650 Bandar Baru Bangi, Selangor, Malaysia",2.962349,101.752512,Government/Defence,https://www.mgtc.gov.my/,,,,,,0,0,0,1,0,0,0,0,
1.58764E+14,Malaysian Refining Company Sdn Bhd,"Bangunan Pentadbiran Sungai Udang, Malaysia, Persiaran Penapisan 76300 Sungai Udang Melaka",malaysian-refining-company-158764060744640,,20,4.95,/companies/158764060744640/company-reviews/summary,/companies/158764060744640/company-reviews,186833,,,,Others,,,,,,,0,0,0,0,0,0,1,0,
442624,Malaysian SH Electronics Sdn Bhd,"Lot 5,7&9, Jalan Ragum 15/17, Seksyen 15, 40200 Shah Alam, Selangor, Malaysia",malaysian-sh-electronics-442624,180965-A,8,4.125,/companies/442624/company-reviews/summary,/companies/442624/company-reviews,10588,"Lot 5,7&9, Jalan Ragum 15/17, Seksyen 15, 40200 Shah Alam, Selangor, Malaysia",,,Manufacturing/Production,,,,subekhi.sunarno@my.cwtcglobal.com,Muhammad Nor Subekhi Bin Sunarno, Engineer,1,0,0,0,0,0,0,0,
,Malaysian Space Agency (MYSA),,,,,,,,,,,,,,,,,,,1,0,0,0,0,0,0,0,"No.13, Jalan Tun Ismail, 50480 KUALA LUMPUR, MALAYSIA"
460683,Malim Consulting Engineers Sdn Bhd,"17-B, Jalan Tapah, Kaw. 18, 41400 Klang, Selangor",malim-consulting-engineers-460683,731105-A,1,5,/companies/460683/company-reviews/summary,/companies/460683/company-reviews,72887,"17-B, Jalan Tapah, Kaw. 18, 41400 Klang, Selangor",3.051715,101.445195,"Consulting (IT, Science, Engineering & Technical)",,,,,,,0,0,0,0,1,0,0,0,
440819,Manulife Insurance Berhad,"Menara Manulife, 6, Jalan Gelenggang, Damansara Heights, 50490 Kuala Lumpur",manulife-insurance-berhad-440819,814942-M,53,3.5094,/companies/440819/company-reviews/summary,/companies/440819/company-reviews,4740,"Menara Manulife, 6, Jalan Gelenggang, Damansara Heights, 50490 Kuala Lumpur",,,Insurance,http://www.manulife.com.my,,,,,,0,0,0,0,0,1,0,0,
464376,Maqo Technologies (M) Sdn Bhd,"No. 27 Jalan TPP 1/1, Taman Perindustrian Puchong, 47100 Puchong Selangor",maqo-technologies-m-464376,1055077-W,21,4.5238,/companies/464376/company-reviews/summary,/companies/464376/company-reviews,84568,"No. 27 Jalan TPP 1/1, Taman Perindustrian Puchong, 47100 Puchong Selangor",,,Utilities/Power,http://www.maqoSolar.com,,,,,,0,0,0,0,1,0,1,0,
,MARKASH STUDIO,,,,,,,,,,,,,,,,,,,0,0,0,1,0,0,0,0,
440119,Maruwa (Malaysia) Sdn Bhd,"Lot 2, 3,4, 27, 28, 30 & 31, Berendam Free Trade Zone, Phase 3, Industrial Estate, 75350 Melaka",maruwa-malaysia-440119,,23,3.913,/companies/440119/company-reviews/summary,/companies/440119/company-reviews,2321,"Lot 2, 3,4, 27, 28, 30 & 31, Berendam Free Trade Zone, Phase 3, Industrial Estate, 75350 Melaka",2.189594,102.250087,Electrical & Electronics,http://www.maruwa.com.my/,,,sivakumar@maruwa.com.my,Mr.sivakumar, Operation Manager,1,0,0,0,0,0,0,0,
,MASHIBA ELEVATORS SDN BHD,"No. 18, Jalan Utara, Off Jalan Imbi",,,,,,,,,,,,,,,,,,0,0,0,0,0,0,1,0,
461616,Mass Rapid Transit Corporation Sdn Bhd,"Tingkat 5, Menara I & P 1, 46, Jalan Dungun, Bukit Damansara, 50490 Kuala Lumpur",mass-rapid-transit-corporation-461616,902884V,75,4.7867,/companies/461616/company-reviews/summary,/companies/461616/company-reviews,77593,"Tingkat 5, Menara I & P 1, 46, Jalan Dungun, Bukit Damansara, 50490 Kuala Lumpur",,,Construction/Building/Engineering,http://www.mymrt.com.my,,,,,,0,0,0,0,1,0,0,0,
610562,Materialise Sdn Bhd,"Unit 5-01, Menara OBYU, No. 4, Jalan PJU 8/8A, Damansara Perdana, 47820, Petaling Jaya, Selangor, Malaysia",materialise-610562,964242-P,32,4.1563,/companies/610562/company-reviews/summary,/companies/610562/company-reviews,5590,"Unit 5-01, Menara OBYU, No. 4, Jalan PJU 8/8A, Damansara Perdana, 47820, Petaling Jaya, Selangor, Malaysia",3.165281,101.612343,"Consulting (IT, Science, Engineering & Technical)",http://www.materialise.com,,,,,,0,0,0,0,1,0,0,1,
449862,Matrix Concepts Holdings Berhad,"Wisma Matrix, No57 Jalan Tun Dr Ismail 70200 Seremban Negeri Sembilan Malaysia",matrix-concepts-holdings-berhad-449862,448098-U,38,3.7632,/companies/449862/company-reviews/summary,/companies/449862/company-reviews,33724,"Wisma Matrix, No57 Jalan Tun Dr Ismail 70200 Seremban Negeri Sembilan Malaysia",2.732337,101.93628,Property/Real Estate,,,06-07642688,,,,0,0,0,0,0,1,0,0,
808039,MATRIX CONCEPTS HOLDINGS BERHAD,"No 57 Wisma Matrix, Jalan Tun Dr Ismail 70200 Seremban Negeri Sembilan Malaysia",matrix-concepts-holdings-berhad-808039,689638-X,38,4.2895,/companies/808039/company-reviews/summary,/companies/808039/company-reviews,100373,"No 57 Wisma Matrix, Jalan Tun Dr Ismail 70200 Seremban Negeri Sembilan Malaysia",,,Property/Real Estate,http://www.mchb.com.my/,,,,,,0,0,0,0,0,0,1,0,
,MATRIX GLOBAL SCHOOLS,"Pt 12652, Sendayan Merchant Square, Persiaran 1 Sendayan Utama, Pusat Dagangan Sendayan, 71950, Bandar Sri Sendayan, Negeri Sembilan.",,,,,,,,,,,,,,,,,,0,0,0,0,0,0,1,0,
1.64E+14,Mavenstream Advisory Services,"62-1, Jalan Paya Emas 1, Taman Paya Emas, 76450 Melaka. ",mavenstream-advisory-services-164360979738986,,0,0,/companies/164360979738986/company-reviews/summary,/companies/164360979738986/company-reviews,241475,,,,Others,,,,,,,0,0,1,0,0,0,0,0,
629429,Maveriq Av Sdn. Bhd.,"No. 6, Jalan Tinggi 6/12, Petaling Jaya, 46000 Selangor",maveriq-av-629429,544331-U,0,0,/companies/629429/company-reviews/summary,/companies/629429/company-reviews,42950,"No. 6, Jalan Tinggi 6/12, Petaling Jaya, 46000 Selangor",,,Entertainment/Media,,,'012-2175553',meredith@maveriq.asia,Meredith McLean, Executive Producer,0,1,0,0,0,0,0,0,
