company_id,Company name,Company address,company_name_slug,company_no,reviews_count,average_company_rating,company_review_summary_url,company_review_url,foreign_company_id,map_address,map_latitude,map_longitude,industry,website_url,Secondary Address,Company Tel,Company Email,Contact Person,Position,FET,FCA,FOB,FCM,FOE,FOM,FIST,FCI,tertiary address
,PRICE WATERHOUSE AND COOPERS & LYBRAND (PwC),"LEVEL 10, 1 Sentral, JALAN RAKYAT, 50706 KUALA LUMPUR, MALAYSIA.",,,,,,,,,,,,,,,,,,0,0,0,0,0,1,0,0,
1.63E+14,PricewaterhouseCoopers,"16th Floor, Menara Ansar, Jalan Abdullah Ibrahim, Bandar Johor Bahru, 80000 Johor Bahru, Johor",pricewaterhousecoopers-163272379958819,AF 1146,0,0,/companies/163272379958819/company-reviews/summary,/companies/163272379958819/company-reviews,1291,,,,Consulting (Business & Management),,,,,,,0,0,1,0,0,0,0,0,
1282786,PRO B CENTRE SDN. BHD,"Wisma Cheng & Co, No. 178-G & 180-G, Jalan Munshi Abdullah, 75100 Melaka",pro-b-centre-1282786,904958-D,3,4,/companies/1282786/company-reviews/summary,/companies/1282786/company-reviews,159720,,,,Apparel,,,,,,,0,0,1,0,0,0,0,0,
,Prodrones Asia,,,,,,,,,,,,,,,,wen@prodrones.asia,Cheaw Wen Guey, Employee,1,0,0,0,0,0,0,0,"The Mezzanine @ A-G-06, Block Allamanda, 10 Boulevard, PJU 6A, Lebuhraya Sprint,47400 Damansara Utama, Selangor, Malaysia."
,PROFESSIONAL SKILL TRAINING CENTRE (SHANG PHILOSOPHY),"World Entrepreneur Institute D-S-7-01 Metropolitan Square, Jalan PJU 8/1, Bandar Damansara Perdana, Bukit Lanjan, 47820 Petaling Jaya, Selangor.",,,,,,,,,,,,,,,,,,0,0,0,0,0,0,1,0,
1319349,PROJECT M,"28A, Jalan Harmonium 23/13, Taman Desa Terbrau, 81100 Johor Bahru, Johor",project-m-1319349,JM0694954-T,1,5,/companies/1319349/company-reviews/summary,/companies/1319349/company-reviews,167591,"28A, Jalan Harmonium 23/13, Taman Desa Terbrau, 81100 Johor Bahru, Johor",,,Advertising/Marketing/Promotion/PR,,,,,,,0,0,0,0,0,0,1,0,
,Projek Lintasan Kota Holdings Sdn. Bhd.,"Projek Lintasan Kota Holdings Sdn Bhd Peti 2, 
Tingkat 12, Menara PNB 201- A, 
Jalan Tun Razak 50400, Kuala Lumpur
",,,,,,,,,,,,,,,,,,0,0,0,0,0,1,0,0,
452869,Prokhas Sdn Bhd,"Lorong Dungun, Bukit Damansara, 50480 Kuala Lumpur, Federal Territory of Kuala Lumpur, Malaysia",prokhas-452869,471243M,21,4.3333,/companies/452869/company-reviews/summary,/companies/452869/company-reviews,43341,"Lorong Dungun, Bukit Damansara, 50480 Kuala Lumpur, Federal Territory of Kuala Lumpur, Malaysia",3.15365,101.665669,Consulting (Business & Management),http://www.prokhas.com.my,,,,,,0,0,0,0,0,0,0,1,
1017040,PROPER TAXATION MANAGEMENT SDN BHD,"76A, Jalan Kundang 4, Taman Bukit Pasir, 83000 Batu Pahat, Johor",proper-taxation-management-1017040,1035421-A,0,0,/companies/1017040/company-reviews/summary,/companies/1017040/company-reviews,116964,,,,Accounting/Audit/Tax Services,,,,,,,0,0,1,0,0,0,0,0,
452119,Protech Builders Sdn. Bhd.,"Jalan Mp4, 75350 Melaka, Malaysia",protech-builders-452119,542587T,11,4.0909,/companies/452119/company-reviews/summary,/companies/452119/company-reviews,41061,"Jalan Mp4, 75350 Melaka, Malaysia",2.248165,102.240405,Construction/Building/Engineering,,,,hr@protechbuilders.my,Nur Hidayati Binti Mohd Adil; Mohd Syafiq B Yahaya,,1,0,0,0,0,0,0,0,
,PSE Technology Sdn. Bhd.,,,,,,,,,,,,,,,,metamachinery17@gmail.com,Mr. Ben Hoh, Engineer,1,0,0,0,0,0,0,0,"No.32-1 Jln Pj 18 Tmn Pertam Jaya Semabok, Melaka, 75050 Malaysia"
610007,Public Bank Berhad,Menara Public Bank Jalan Ampang Wilayah Persekutuan Kuala Lumpur,public-bank-berhad-610007,6463-H,369,3.8753,/companies/610007/company-reviews/summary,/companies/610007/company-reviews,2643,Menara Public Bank Jalan Ampang Wilayah Persekutuan Kuala Lumpur,,,Banking/Financial Services,http://www.publicbankgroup.com,"1, Jalan Air Hitam, Kawasan Institusi, Bandar Baru Bangi, Bangi, 43000, Kajang, Selangor, 43000",,,,,0,0,0,0,0,0,0,1,
1.65E+14,Public Mutual,"Menara Public Bank 2, No. 78, Jalan Raja Chulan, 50200 Kuala Lumpur, Malaysia.",public-mutual-165173145455505,-,1,5,/companies/165173145455505/company-reviews/summary,/companies/165173145455505/company-reviews,256189,"Menara Public Bank 2, No. 78, Jalan Raja Chulan, 50200 Kuala Lumpur, Malaysia.",,,Others,,,,,,,0,0,0,0,0,0,0,1,
442500,Publicis Groupe Malaysia,"Level 5 Menara Olympia, 8 Jalan Raja Chulan, 50200 Kuala Lumpur",publicis-groupe-malaysia-442500,250069-U,35,3.4857,/companies/442500/company-reviews/summary,/companies/442500/company-reviews,10199,"Level 5 Menara Olympia, 8 Jalan Raja Chulan, 50200 Kuala Lumpur",,,Advertising/Marketing/Promotion/PR,,,,,,,0,0,0,1,0,0,0,1,
,Pure IT Solutions,"Riyadh, Mecca Street, Khartoum 10002, Sudan",,,,,,,,,,,,,,,,,,0,0,0,0,0,0,0,1,
1.6E+14,PURNAMA SOLUTION (M) SDN BHD,,purnama-solution-m-160466149036027,568408-P,2,5,/companies/160466149036027/company-reviews/summary,/companies/160466149036027/company-reviews,196461,,,,Telecommunication,,,,,,,1,0,0,0,0,0,0,0,"S-09-03 First Subang Jalan SS 15/4G SUBANG JAYA, Selangor, 47500 Malaysia"
1.58E+14,Pusat Khidmat Rakyat Parlimen,,pusat-khidmat-rakyat-parlimen-1282793,,3,5,/companies/1282793/company-reviews/summary,/companies/1282793/company-reviews,159727,,,,Others,,,,,,,0,0,0,1,0,0,0,0,
831717,Putra Specialist Hospital (Batu Pahat) Sdn Bhd,Putra Specialist Hospital (Batu Pahat) Sdn. Bhd.. Jalan Peserai Batu Pahat Johor Malaysia,putra-specialist-hospital-batu-pahat-831717,119039X,16,3.4667,/companies/831717/company-reviews/summary,/companies/831717/company-reviews,99012,Putra Specialist Hospital (Batu Pahat) Sdn. Bhd.. Jalan Peserai Batu Pahat Johor Malaysia,1.857969,102.922373,Healthcare/Medical,http://www.putrabatupahat.com,"No 69, Jalan Bendahara, Pengkalan Rama, 75100 Melaka",,,,,0,0,1,0,0,0,0,0,
468970,PWC Group,"8, Jalan Tiang U8/92, Seksyen U8 Bukit Jelutong, 40150 Shah Alam",pwc-group-468970,491422-U,10,3.4,/companies/468970/company-reviews/summary,/companies/468970/company-reviews,90404,"8, Jalan Tiang U8/92, Seksyen U8 Bukit Jelutong, 40150 Shah Alam",3.120272,101.525985,Construction/Building/Engineering,,"Level 10, Menara TH 1 Sentral, Jalan Rakyat, Kuala Lumpur Sentral, 50706 Kuala Lumpur, Wilayah Persekutuan Kuala Lumpur",,,,,0,0,0,0,0,0,1,0,
,QL RESOURCES SDN BHD,"NO 16A JALAN ASTAKA U8/83, BUKIT JELUTONG BUSINESS AND TECHNOLOGY CENTRE 40150 SHAH ALAM SELANGOR",,,,,,,,,,,,,,,,,,0,0,0,0,0,1,0,0,
1.58E+14,QQ Resources Sdn Bhd,"No.13-0 & 13-1, Jalan BK6F/3A, Bandar Kinrara, 47180 Puchong Selangor Malaysia",qq-resources-443998,416724-D,0,0,/companies/443998/company-reviews/summary,/companies/443998/company-reviews,14681,"No.13-0 & 13-1, Jalan BK6F/3A, Bandar Kinrara, 47180 Puchong Selangor Malaysia",3.045949,101.635863,Consumer Products/FMCG,,,,,,,0,0,0,1,0,0,0,0,
440108,QR Retail Automation (Asia) Sdn Bhd,"1-01, Bagunan Yin, 1st Floor, No 7 Section 16/11, Off Jalan Damansara, 46350 Petaling Jaya, Selangor.",qr-retail-automation-asia-440108,249473-V,19,3.7895,/companies/440108/company-reviews/summary,/companies/440108/company-reviews,2299,"1-01, Bagunan Yin, 1st Floor, No 7 Section 16/11, Off Jalan Damansara, 46350 Petaling Jaya, Selangor.",,,Computer/Information Technology (Software),http://www.qrra.com,,,,,,0,0,0,0,0,0,0,1,
,QT Kidz Sdn. Bhd.,"43-1, Jalan MPK 4, Medan Perniagaan Kepayang, 70200 Seremban, Negeri Sembilan",,,,,,,,,,,,,,,,,,0,0,0,0,0,0,1,1,
,QuickDesk,"WorQ, Unit 3.07, Level 3, KL Gateway Mall Gateway Mall, No 2, Jalan Kerinchi, Pantai Dalam, 59200 Kuala Lumpur",,,,,,,,,,,,,,,,,,0,0,0,0,0,0,0,1,
1.63169E+14,R8 Solution,"B-8-6-13A, 6th Floor Block B, Setiawalk Persiaran Wawasan, Pusat Bandar Puchong, 47160 Puchong Selangor.",r8-solution-163168700392940,,0,0,/companies/163168700392940/company-reviews/summary,/companies/163168700392940/company-reviews,218278,,,,Computer/Information Technology (Hardware),,,,,,,0,0,0,0,0,0,1,0,
441660,Rabin & Associates,"C-12-5, Level 12, Block C, Megan Avenue II, 12 Jalan Yap Kwan Seng, 50450 Kuala Lumpur",rabin-n-associates-441660,AF1323,22,3,/companies/441660/company-reviews/summary,/companies/441660/company-reviews,7398,"C-12-5, Level 12, Block C, Megan Avenue II, 12 Jalan Yap Kwan Seng, 50450 Kuala Lumpur",3.162008,101.71221,Accounting/Audit/Tax Services,http://www.rabinco.com.my,,03-27110080,,,,0,0,0,0,0,1,0,0,
,RAPTOR TECHNOLOGIES SDN BHD,"Menara K1,Units 13A-12 Lorong 3/137C Off Jalan Klang Lama,58200 Kuala Lumpur Malaysia",,,,,,,,,,,,,,,,,,0,0,0,0,0,0,1,0,
,Rawaj Marketing and Media Production Center,,,,,,,,,,,,,,,'+97337705519',saber.alsaeed@gmail.com,Saber Jassin Al Saeed, Supervisor,0,1,0,0,0,0,0,0,
,RAZER MERCHANT SERVICES,"J-39-1, Block J, Jalan Multimedia, I-City, 40000 Shah Alam, Selangor",,,,,,,,,,,,,,,,,,0,0,0,0,0,0,1,0,
,RedHill Travel & Tours Sdn Bhd ,"located at No 36, Tingkat, 1, Jalan Ibrahim, Sungai Petani, 08000 Sungai Petani",,,,,,,,,,,,,,,,,,0,0,0,0,0,0,0,1,
1003387,Redtone Mex Sdn Bhd,,redtone-mex-1003387,1052697-U,0,0,/companies/1003387/company-reviews/summary,/companies/1003387/company-reviews,112055,,,,Healthcare/Medical,http://www.redtone.com/healthcare/,,,,,,1,0,0,0,0,0,0,0,"Suite 22-30 5th Floor IOI Business Park PUCHONG, Selangor, 47100 Malaysia"
1.64E+14,REEL STUDIO,,reel-studio-163937629341327,JM0508415-K,0,0,/companies/163937629341327/company-reviews/summary,/companies/163937629341327/company-reviews,232573,,,,Entertainment/Media,,,'016-7899996',info@reelstudio.com.my,Vishnu Dev a/l Sithaam, Director,0,1,0,0,0,0,0,0,
1.65E+14,REGOV TECHNOLOGIES SDN. BHD.,"C-7-01, Capital 3, Oasis Square, No.2, Jalan PJU 1A/7A, Ara Damansara, 47301, Petaling Jaya, Selangor, Malaysia.",regov-technologies-164991772144759,1246645-K,1,5,/companies/164991772144759/company-reviews/summary,/companies/164991772144759/company-reviews,254235,"C-7-01, Capital 3, Oasis Square, No.2, Jalan PJU 1A/7A, Ara Damansara, 47301, Petaling Jaya, Selangor, Malaysia.",,,Computer/Information Technology (Software),,,,,,,0,0,0,0,0,0,0,1,
1.58E+14,Reina Marine LTD,,reina-marine-ltd-650666,,0,0,/companies/650666/company-reviews/summary,/companies/650666/company-reviews,77811,,,,Marine/Aquaculture,,,,,,,0,0,0,1,0,0,0,0,
,REPRISE TECH - IPG MEDIABRANDS,,,,,,,,,,,,,,,,,,,0,0,0,1,0,0,0,0,
468697,Reservoir World Sdn Bhd,"unit B-11-01 , Gateway Kiaramas ( Corporate Suite ) Kiaramas , Mont Kiara , KUala Lumpur.",reservoir-world-468697,1069606-H,2,5,/companies/468697/company-reviews/summary,/companies/468697/company-reviews,90062,"unit B-11-01 , Gateway Kiaramas ( Corporate Suite ) Kiaramas , Mont Kiara , KUala Lumpur.",,,Entertainment/Media,https://www.reservoirproduction.com/,,'017-4744697',sabrina@reservoirworld.com,Sabrina Wong Jen Wee, Producer,0,1,0,0,0,0,0,0,
471037,Resourceleap Consultancy Sdn Bhd,"A-1-38, IOI Boulevard, Jalan Kenari 5, Bandar Puchong Jaya, 47170 Puchong, Selangor.",resourceleap-consultancy-471037,1111128-X,4,4.75,/companies/471037/company-reviews/summary,/companies/471037/company-reviews,92901,"A-1-38, IOI Boulevard, Jalan Kenari 5, Bandar Puchong Jaya, 47170 Puchong, Selangor.",,,Computer/Information Technology (Software),http://www.resourceleap.com,,,,,,0,0,0,0,0,0,0,1,
,Revideo Precision Engineering Sdn Bhd,,,,,,,,,,,,,,,,,,,1,0,0,0,0,0,0,0,"2B-9 Jln Kesidang 3/6 Melaka Mall Off Jln Tun Perak MELAKA, Melaka, 75300 Malaysia"
452284,RGBA Studio Sdn Bhd,"14 Jalan SS 20/10, Damansara Kim, 47400 Petaling Jaya, Selangor, Malaysia",rgba-studio-452284,816875-K,7,2.4286,/companies/452284/company-reviews/summary,/companies/452284/company-reviews,41564,"14 Jalan SS 20/10, Damansara Kim, 47400 Petaling Jaya, Selangor, Malaysia",3.136131,101.629096,Entertainment/Media,,,'016-4200986',dietarryl82@gmail.com,Fatkhul Aarif B Hilaluddin, Head od Department,0,1,0,0,0,0,0,0,
,RHA Consulting Engineers Sdn Bhd,"186, Lorong Putra 1/D, Pusat Perniagaan Putra, Jalan Kilang Lama, Kulim 9000 Kedah Malaysia.",,,,,,,,,,,,,,,,,,0,0,0,0,1,0,0,0,
1.59E+14,Rhythm Heights Corporation Sdn Bhd,"No.17 M, Jalan SBC 1 Taman Seri Batu Caves Batu Caves 68100",rhythm-heights-corporation-456924,477842-W,0,0,/companies/456924/company-reviews/summary,/companies/456924/company-reviews,56101,"No.17 M, Jalan SBC 1 Taman Seri Batu Caves Batu Caves 68100",3.182896,101.690713,Exhibitions/Event management/MICE,http://www.rhythmheights.com,,,,,,0,0,0,1,0,0,0,0,
1.58183E+14,RN TECHNOLOGIES SDN. BHD.,"No. 28-A Jalan Horizon Perdana 3, Horizon Avenue Commercial Centre, Horizon Hills, 79100 Iskandar Puteri, Johor.",rn-technologies-158183375665975,966695-U,1,3,/companies/158183375665975/company-reviews/summary,/companies/158183375665975/company-reviews,184421,,,,Computer/Information Technology (Software),https://www.rntechnologies.com.my/,,,,,,0,0,0,0,0,0,1,0,
439450,Robert Bosch (M) Sdn Bhd,"Free Industrial Zone 1, Phase 1, 11900 Bayan Lepas, Penang",robert-bosch-m-439450,012007-X,104,4.125,/companies/439450/company-reviews/summary,/companies/439450/company-reviews,201,"Free Industrial Zone 1, Phase 1, 11900 Bayan Lepas, Penang",,,Manufacturing/Production,https://www.bosch.com.my/careers/,,,,,,0,0,0,0,1,0,0,0,
,Rocca Cool,"P.O.Box 958, PC 122, Maabella Ind Area 8, Seeb, Muscat Oman, OMN",,,,,,,,,,,,,,,,,,0,0,0,0,0,1,0,0,
440106,Roche (Malaysia) Sdn Bhd,"Level 58, The Intermark, 348 Jalan Tun Razak, 50400, Kuala Lumpur",roche-malaysia-440106,11792-H,40,4.075,/companies/440106/company-reviews/summary,/companies/440106/company-reviews,2294,"Level 58, The Intermark, 348 Jalan Tun Razak, 50400, Kuala Lumpur",3.159518,101.708827,Healthcare/Medical,,"Level 14, The Pinnacle, Persiaran Lagoon, Bandar Sunway
47500 Subang Jaya, Selangor Darul Ehsan, Malaysia",,,,,0,0,0,0,0,0,0,1,
1.6E+14,Rocketsview Management Sdn Bhd,"K-1-7, 1st Floor, Kuchai Business Park, Jalan 1/127, Off Jalan Kuchai Lama, 58200 Kuala Lumpur",rocketsview-management-455780,1296289-M,15,4.4667,/companies/455780/company-reviews/summary,/companies/455780/company-reviews,52359,"K-1-7, 1st Floor, Kuchai Business Park, Jalan 1/127, Off Jalan Kuchai Lama, 58200 Kuala Lumpur",,,Computer/Information Technology (Software),http://www.rocketsview.com,,,,,,0,0,0,1,0,0,0,0,
1.6E+14,ROI OPTIMUM RESOURCES SDN BHD,"12-1, Lorong Haruan 5/1, Oakland Commercial Centre, 70300 Seremban, Negeri Sembilan",roi-optimum-resources-163049515598085,1396028-U,1,4,/companies/163049515598085/company-reviews/summary,/companies/163049515598085/company-reviews,216870,"12-1, Lorong Haruan 5/1, Oakland Commercial Centre, 70300 Seremban, Negeri Sembilan",,,General & Wholesale Trading,,,,,,,0,0,0,1,0,0,0,0,
,Roll Robotics Sdn Bhd,"D1-04-05, Tamarind Square, Persiaran Multimedia, 63000 Cyberjaya, Selangor Darul Ehsan, Malaysia.",,,,,,,,,,,,,,,,,,0,0,0,0,1,0,0,0,
,ROYAL BANK OF CANADA INVESTOR & TREASURY SERVICES,"WISMA RBC, BLOCK 3544, PERSIARAN APEC, 63000 CYBERJAYA, SELANGOR, MALAYSIA.",,,,,,,,,,,,,,,,,,0,0,0,0,0,1,0,0,
,ROZIATUN & ASSOCIATES,"No. 80A, Tingkat 1, Jalan Permai 1, Taman Desa Permai, Sungai Lalang, 08100 Bedong, Kedah",,,,,,,,,,,,,,04-4589195,,,,0,0,0,0,0,1,0,0,
,RSM Malaysia,"Suite 16-02, Level 16, Menara Landmark,
No. 12, Jalan Ngee Heng,
80000 Johor Bahru, Johor, Malaysia. ",,,,,,,,,,,,,,,,,,0,0,1,0,0,0,0,0,
,runlowboy Production,,,,,,,,,,,,,,,'012-2004493',runlowboy.malaysia@gmail.com,Ahmad Izzat Latip, Associate Producer,0,1,0,0,0,0,0,0,
1.6E+14,RUNNINGMAN EXPRESS FOOD DELIVERY SDN. BHD.,Kota Damansara,runningman-express-food-delivery-163393330449426,1156700-H,0,0,/companies/163393330449426/company-reviews/summary,/companies/163393330449426/company-reviews,222669,Kota Damansara,,,Food & Beverage/Catering/Restaurant,https://runningmen.my/,,,,,,0,0,0,1,0,0,0,0,
866553,RW WILLIAM (Classifieds),,rw-william-classifieds-866553,AF1490,0,0,/companies/866553/company-reviews/summary,/companies/866553/company-reviews,107414,,,,Accounting/Audit/Tax Services,,"9-3A, Mayang Plaza,Jalan SS 26/4, Taman Mayang Jaya, 47301 Petaling Jaya, Selangor Darul Ehsan, Malaysia",03-78053859,,,,0,0,0,0,0,1,0,0,
,"RY MARKETING & MEDIA AGENCY, SINGAPORE",,,,,,,,,,,,,,,,,,,0,0,0,1,0,0,0,0,
,RYIM PHOTOGRAPHY STUDIO,,,,,,,,,,,,,,,,,,,0,0,0,1,0,0,0,0,
,S Association,"1st Floor, 26 & 28, Jalan Putra, 05100 Alor Setar, Kedah",,,,,,,,,,,,,,,,,,0,0,1,0,0,0,0,0,
,S. P Kong & Chang ,"B 170, 1st Floor 

Jalan Dato Lim Hoe 

25200 Kuantan, Pahang ",,,,,,,,,,,,,,,,,,0,0,1,0,0,0,0,0,
440058,S.E.H. (Shah Alam) Sdn Bhd,"S.E.H. (Shah Alam) Sdn Bhd, Jalan Sementa 27/91, Taman Bunga Negara, Shah Alam Selangor",seh-shah-alam-440058,266571-M,10,4.5,/companies/440058/company-reviews/summary,/companies/440058/company-reviews,1936,"S.E.H. (Shah Alam) Sdn Bhd, Jalan Sementa 27/91, Taman Bunga Negara, Shah Alam Selangor",,,Manufacturing/Production,http://www.sehmy.com,,,,,,0,0,0,0,1,0,0,0,
452334,S.M. Tuang & Co. (AF 0001),"18-1B, Jalan Pandan 2/1 Pandan Jaya, 55100, KL",sm-tuang-n-co-af-0001-452334,AF 0001,15,3.3333,/companies/452334/company-reviews/summary,/companies/452334/company-reviews,41740,"18-1B, Jalan Pandan 2/1 Pandan Jaya, 55100, KL",3.135278,101.739703,Accounting/Audit/Tax Services,http://www.smtuang.com,,03-92843473,,,,0,0,0,0,0,1,0,0,
638529,Sabah Electricity Sdn Bhd,Wisma Sesb 88673 Jalan Tunku Abdul Rahman Kota Kinabalu Sabah Malaysia,sabah-electricity-638529,462872-W,35,4.7143,/companies/638529/company-reviews/summary,/companies/638529/company-reviews,59603,Wisma Sesb 88673 Jalan Tunku Abdul Rahman Kota Kinabalu Sabah Malaysia,5.970494,116.074744,Utilities/Power,,,,,,,0,0,0,0,1,0,0,0,
,SAIFUL NANG ACADEMY,,,,,,,,,,,,,,,,,,,0,0,0,1,0,0,0,0,
,SALAM ALLIANCE SDN BHD,"No 70-1, JALAN 7/7a, SEKSYEN 7, 43650 BANDAR BARU BANGI, SELANGOR",,,,,,,,,,,,,,,,,,0,0,0,0,0,1,0,0,
439734,SAM Meerkat (M) Sdn Bhd,"Plot 103 & 104 Hilir Sungai Keluang Lima, Taman Perindustrian Bayan Lepas 4, 11900 Penang Malaysia",sam-meerkat-m-439734,,34,3.5882,/companies/439734/company-reviews/summary,/companies/439734/company-reviews,946,"Plot 103 & 104 Hilir Sungai Keluang Lima, Taman Perindustrian Bayan Lepas 4, 11900 Penang Malaysia",,,Manufacturing/Production,,,,,,,0,0,0,0,1,0,0,0,
1.61E+14,Sambill Park (M) Sdn. Bhd.,,sambill-park-m-631104,750787-M,1,5,/companies/631104/company-reviews/summary,/companies/631104/company-reviews,46206,,,,Entertainment/Media,http://www.dj-events.com,,,,,,0,0,0,1,0,0,0,0,
442262,Samsung Malaysia Electronics (SME) Sdn Bhd,"Level 15, Mercu 2
No. 3, Jalan Bangsar, KL Eco City, 
59200 Kuala Lumpur, Malaysia.",samsung-malaysia-electronics-sme-442262,629186-D,292,4.0241,/companies/442262/company-reviews/summary,/companies/442262/company-reviews,9379,"Level 15, Mercu 2\r\nNo. 3, Jalan Bangsar, KL Eco City, \r\n59200 Kuala Lumpur, Malaysia.",3.509247,101.524805,Electrical & Electronics,http://www.samsung.com,"Level15, Mercu 2, No 3 Jalan Bangsar, KL Eco City, 59200 Kuala Lumpur, Malaysia",,,,,0,0,0,0,1,0,1,0,"Suite E-09-01, Level 9, East Wing, ICON Jalan Tun Razak, No. 1, Jalan 1/68F, 50400 Kuala Lumpur, Malaysia. 50400 Kuala Lumpur Malaysia."
,SaphX Technologies Sdn Bhd,"15B, Jalan Tun Mohd Fuad 3, Taman Tun Dr Ismail, 60000",,,,,,,,,,,,,,,,,,0,0,0,1,0,0,0,1,
1.60751E+14,Sapura kencana petroleum Sdn bhd,"Sapura Mines No.7, Jalan Tasik, The Mines Resort City, Seri Kembangan 43300 Selangor Malaysia.",sapura-kencana-petroleum-160751273193022,,2,3,/companies/160751273193022/company-reviews/summary,/companies/160751273193022/company-reviews,198238,,,,Others,,,,,,,0,0,0,0,1,0,0,0,
623280,Sarawak Energy Berhad,,sarawak-energy-berhad-623280,672931-A,58,4.6207,/companies/623280/company-reviews/summary,/companies/623280/company-reviews,31177,,,,Utilities/Power,https://www.sarawakenergy.com.my,,,chosen.yap@sarawakenergy.com,Yap Cho Sen, Assistant General Manager,1,0,0,0,0,0,0,0,9Th Floor Menara Sarawak Energy No.1 The Isthmus 93050 Kuching Sarawak
627631,Sarawak Information Systems Sdn. Bhd.,"Level 3, Wisma Bapa Malaysia, Petra Jaya, 93502 Kuching, Sarawak, Malaysia",sarawak-information-systems-627631,213181-W,18,3.1667,/companies/627631/company-reviews/summary,/companies/627631/company-reviews,39516,"Level 3, Wisma Bapa Malaysia, Petra Jaya, 93502 Kuching, Sarawak, Malaysia",,,"Consulting (IT, Science, Engineering & Technical)",http://sains.com.my,,,,,,0,0,0,0,0,0,0,1,
1269199,Sarawak Media Group Sdn Bhd,,sarawak-media-group-1269199,1275830-A,1,3,/companies/1269199/company-reviews/summary,/companies/1269199/company-reviews,156332,,,,Advertising/Marketing/Promotion/PR,,,'013-8150766',lau@smg.my,Lau Ung Ing, Head of Content,0,1,0,1,0,0,0,0,
,Satay Production,,,,,,,,,,,,,,,'016-6115066',satay.production@gmail.com,Cavan Tay, Producer,0,1,0,0,0,0,0,0,
1013361,SC CHU & CO,"No.5-01,Jalan Mesra, Taman Sayang,86000 Kluang, johor",sc-chu-n-co-1013361,AF 002243,0,0,/companies/1013361/company-reviews/summary,/companies/1013361/company-reviews,115404,"No.5-01,Jalan Mesra, Taman Sayang,86000 Kluang, johor",,,Accounting/Audit/Tax Services,,,,,,,0,0,1,0,0,0,0,0,
624239,SC Chua & Associates,"No. 10 (2nd Floor), Jalan Arab, 84000 Muar",sc-chua-n-associates-624239,AF 1246,1,5,/companies/624239/company-reviews/summary,/companies/624239/company-reviews,33037,"No. 10 (2nd Floor), Jalan Arab, 84000 Muar",2.046048,102.569218,Accounting/Audit/Tax Services,,,,,,,0,0,1,0,0,0,0,0,
1.63449E+14,Schlumberger Group,,schlumberger-group-163448744311433,,1,5,/companies/163448744311433/company-reviews/summary,/companies/163448744311433/company-reviews,223813,,,,Others,,"Level 22 & 23, 1 First Avenue, 47800, Petaling Jaya, Selangor.",03-77248688,,,,0,0,0,0,0,1,0,0,
441673,SCIENTEX PACKAGING (AYER KEROH) BERHAD,"Lot 3 & 7, Kawasan Perindustrian Air Keroh, Fasa IV, Air Keroh, Melaka",scientex-packaging-ayer-keroh-berhad-441673,12994-W,21,4.3,/companies/441673/company-reviews/summary,/companies/441673/company-reviews,7441,"Lot 3 & 7, Kawasan Perindustrian Air Keroh, Fasa IV, Air Keroh, Melaka",,,Polymer/Plastic/Rubber/Tyres,,,,kwlau@scientex.com.my,Mr. Lau Kok Wah, Assistant Manager,1,0,0,0,0,0,0,0,
439852,SDP Manufacturing Sdn. Bhd.,34 Jalan Masyhur 1 Taman Perindustrian Cemerlang Ulu Tiram Johor Malaysia,sdp-manufacturing-439852,239972-T,14,3.7857,/companies/439852/company-reviews/summary,/companies/439852/company-reviews,1290,34 Jalan Masyhur 1 Taman Perindustrian Cemerlang Ulu Tiram Johor Malaysia,1.556647,103.81975,Manufacturing/Production,,,,patrick.teo@sdaletech.com,Patrick Teo, Engineering Manager,1,0,0,0,0,0,0,0,
,"SEBENAR STUDIO, TWOMAN SDN BHD",,,,,,,,,,,,,,,,,,,0,0,0,1,0,0,0,0,
609921,Securities Commission Malaysia,"Persiaran Bukit Kiara, 50490 Kuala Lumpur, Federal Territory of Kuala Lumpur, Malaysia",securities-commission-malaysia-609921,A1041,56,4.625,/companies/609921/company-reviews/summary,/companies/609921/company-reviews,2258,"Persiaran Bukit Kiara, 50490 Kuala Lumpur, Federal Territory of Kuala Lumpur, Malaysia",3.148024,101.646101,Stockbroking/Securities,,,,,,,0,0,0,0,0,1,0,0,
443031,Seiko Denki (M) Sdn Bhd,"Plo 95, Jalan Cycber 6, Kawasan Perindustrian Senai 3, 81400 Senai, Johor, Malaysia",seiko-denki-m-443031,202192-H,17,3.0588,/companies/443031/company-reviews/summary,/companies/443031/company-reviews,11853,"Plo 95, Jalan Cycber 6, Kawasan Perindustrian Senai 3, 81400 Senai, Johor, Malaysia",1.530512,103.737138,Manufacturing/Production,http://www.seikodenki.com.my/,,,,,,0,0,0,0,0,0,1,0,
,SEKRETARIAT USAHAWAN NEGERI PERAK,,,,,,,,,,,,,,,,,,,0,0,0,1,0,0,0,0,
,"Sela for Power, Automation and Safety Systems (Sela-PASS)",,,,,,,,,,,,,,,,,,,1,0,0,0,0,0,0,0,
443344,Selangor Human Resource Development Centre (SHRDC),"Jalan Tinju 13/50, Seksyen 13, 40100 Shah Alam, Selangor, Malaysia",selangor-human-resource-development-centre-shrdc-443344,5192/96(SEL),15,3.7333,/companies/443344/company-reviews/summary,/companies/443344/company-reviews,12734,"Jalan Tinju 13/50, Seksyen 13, 40100 Shah Alam, Selangor, Malaysia",,,Education,http://www.shrdc.org.my/,,,,,,0,0,0,0,0,0,0,1,
1.57952E+14,Selcare Clinic Sdn Bhd (Classifieds),,selcare-clinic-classifieds-157951730944268,885764-D,0,0,/companies/157951730944268/company-reviews/summary,/companies/157951730944268/company-reviews,182831,,,,Healthcare/Medical,,"No. 47A, Jalan Snuker 13/28, Seksyen 13, 40100, Shah Alam, Selangor.",,,,,0,0,0,0,0,1,0,0,
627967,Semantan Mutiara Sdn Bhd,"Unit 50-6-3A Level 6 Wisma UOA, Jalan Dungun Damansara Heights 50490",semantan-mutiara-627967,,0,0,/companies/627967/company-reviews/summary,/companies/627967/company-reviews,40141,"Unit 50-6-3A Level 6 Wisma UOA, Jalan Dungun Damansara Heights 50490",,,Others,,,,,,,0,0,0,0,1,0,0,0,
448832,Senai-Desaru Expressway Berhad,"Senai-desaru Hwy, 81800 Ulu Tiram, Johor, Malaysia",senai-desaru-expressway-berhad-448832,612633-A,7,4,/companies/448832/company-reviews/summary,/companies/448832/company-reviews,30429,"Senai-desaru Hwy, 81800 Ulu Tiram, Johor, Malaysia",1.581744,103.817882,Construction/Building/Engineering,,,,,,,0,0,0,0,0,0,0,1,
1042555,Senheng Electric (KL) Sdn Bhd,"44B 1st Floor, Jalan Pandan 3/2, Pandan Jaya, 55100 Kuala Lumpur.",senheng-electric-kl-1042555,296691-X,68,3.9706,/companies/1042555/company-reviews/summary,/companies/1042555/company-reviews,118056,"44B 1st Floor, Jalan Pandan 3/2, Pandan Jaya, 55100 Kuala Lumpur.",,,Retail/Merchandise,http://www.senheng.com.my,,,,,,0,0,0,0,0,0,0,1,
,Seni Lab,,,,,,,,,,,,,,,'017-3256642',senilab.inc@gmail.com,Maliq Hussein, Managing Director,0,1,0,0,0,0,0,0,
1.64E+14,Serasi Integrated Solution Sdn Bhd,"Block C-T.02 - U.08, No 1, Jalan P8D, 63350 WP Putrajaya",serasi-integrated-solution-164136363086425,,0,0,/companies/164136363086425/company-reviews/summary,/companies/164136363086425/company-reviews,235675,"Block C-T.02 - U.08, No 1, Jalan P8D, 63350 WP Putrajaya",,,Computer/Information Technology (Software),,,,,,,0,0,0,0,0,0,0,1,
